{
  "version": 1,
  "format": "OpenRigGraph",
  "controllers": [],
  "outputs": [
    {
      "name": "result",
      "type": "scalar",
      "source": "example.output"
    }
  ],
  "nodes": [
    {
      "name": "example",
      "type": "unitConversion",
      "inputs": {
        "input": 0.25
      },
      "params": {
        "conversionFactor": 2
      }
    }
  ]
}
