{
  "version": 1,
  "format": "OpenRigGraph",
  "controllers": [],
  "outputs": [
    {
      "name": "result",
      "type": "scalar",
      "source": "example.outputQuatW"
    }
  ],
  "nodes": [
    {
      "name": "example",
      "type": "axisAngleToQuat",
      "inputs": {},
      "params": {}
    }
  ]
}
