{
  "version": 1,
  "format": "OpenRigGraph",
  "controllers": [],
  "outputs": [
    {
      "name": "result",
      "type": "scalar",
      "source": "example.output"
    }
  ],
  "nodes": [
    {
      "name": "example",
      "type": "multDoubleLinear",
      "inputs": {
        "input1": 2,
        "input2": 3
      },
      "params": {}
    }
  ]
}
