{
  "version": 1,
  "format": "OpenRigGraph",
  "controllers": [],
  "outputs": [
    {
      "name": "result",
      "type": "scalar",
      "source": "example.output"
    }
  ],
  "nodes": [
    {
      "name": "example",
      "type": "blendTwoAttr",
      "inputs": {
        "input[0]": 0,
        "input[1]": 4,
        "attributesBlender": 0.25
      },
      "params": {}
    }
  ]
}
