{
  "version": 1,
  "format": "OpenRigGraph",
  "controllers": [],
  "outputs": [
    {
      "name": "result",
      "type": "scalar",
      "source": "example.outputR"
    }
  ],
  "nodes": [
    {
      "name": "example",
      "type": "blendColors",
      "inputs": {
        "color1R": 4,
        "color2R": 0,
        "blender": 0.25
      },
      "params": {}
    }
  ]
}
