{
  "version": 1,
  "format": "OpenRigGraph",
  "controllers": [],
  "outputs": [
    {
      "name": "result",
      "type": "scalar",
      "source": "example.output"
    }
  ],
  "nodes": [
    {
      "name": "example",
      "type": "choice",
      "inputs": {
        "selector": 1,
        "input[0]": 2,
        "input[1]": 7
      },
      "params": {}
    }
  ]
}
